{
  "version": "1.0.0",
  "released_on": "2026-06-06",
  "summary": "Contract-driven Markdown generation is now part of the generation fabric.",
  "highlights": [
    "Schema-defined content structure",
    "Deterministic Markdown rendering",
    "Reusable scaffolding for new documents"
  ],
  "sections": [
    {
      "title": "Renderer",
      "summary": "The renderer now validates data and emits Markdown from a schema contract.",
      "bullets": [
        "Validates the schema before rendering",
        "Validates the JSON instance against the schema",
        "Writes output atomically"
      ]
    },
    {
      "title": "Quality",
      "summary": "The contract ships with tests and a canonical example payload.",
      "bullets": [
        "Unit tests cover the scaffold and render paths",
        "Example files live in the repository",
        "The schema and sample stay in sync"
      ]
    }
  ]
}
